name,category,sub_category,website,description,february,april,may,average_time_on_website,may_normalized,change_normalized,average_time_normalized,tts,popularity,growth,engagement
Mutiny,Coding,Low-code/no-code,https://mutinyhq.com,"mutiny is a no-code ai platform that helps marketers convert their top of funnel demand into revenue, without engineers.",86624.000,62711.000,77371.000,550.484,0.502,0.431,0.970,6.821,5.020,4.310,9.700
AI Room Planner,Industry-specific,Real Estate,https://airoomplanner.com,,89382.000,166551.000,280975.000,189.427,0.657,0.955,0.640,6.800,6.570,9.550,6.400
Topaz Video AI,Content Creation,Video Editing,https://topazlabs.com,"photo and video enhancement software powered by deep learning gets you the best image quality available for noise reduction, sharpening, upscaling, and more.",2021912.000,2043782.000,1982391.000,135.822,0.842,0.526,0.511,6.780,8.420,5.260,5.110
Topaz Photo AI,Content Creation,Image Editing,https://topazlabs.com,"photo and video enhancement software powered by deep learning gets you the best image quality available for noise reduction, sharpening, upscaling, and more.",2021912.000,2043782.000,1982391.000,135.822,0.842,0.526,0.511,6.780,8.420,5.260,5.110
Scalenut,Marketing,SEO,https://scalenut.com,scalenut is a content intelligence saas platform that helps you discover and create the most relevant content for your customers. it uses deep learning and ai to create the best content possible.,455566.000,357771.000,377779.000,245.000,0.678,0.349,0.755,6.759,6.780,3.490,7.550
Craiyon,Design,Image Generator,https://craiyon.com,"craiyon, formerly dall-e mini, is an ai model that can draw images from any text prompt!",2146634.000,2488151.000,2405027.000,113.461,0.859,0.641,0.451,6.740,8.590,6.410,4.510
Songtell,Entertainment,Music,https://songtell.com,find the meaning of any song in the blink of an eye,1344652.000,1658189.000,2256759.000,96.022,0.856,0.857,0.395,6.717,8.560,8.570,3.950
Hourone,Content Creation,Video Generator,https://hourone.ai,"welcome to hour one, the world's fastest-growing ai video maker. we turn text into video to make learning & development more fun & effective. try now!",152110.000,149847.000,152149.000,285.607,0.585,0.547,0.809,6.708,5.850,5.470,8.090
Ready Player Me,Design,Avatars,https://readyplayer.me/,create a full-body 3d avatar with a selfie and use it in the metaverse. developer? integrate our avatar platform into your app or game.,1202675.000,1361725.000,1375001.000,128.869,0.811,0.662,0.494,6.693,8.110,6.620,4.940
Krisp,Productivity,Productivity,https://krisp.ai,krisp cancels background noise and reduces echo during your calls. get started with krisp today and enjoy effective online meetings.,1384219.000,1142246.000,1031533.000,180.612,0.788,0.271,0.617,6.679,7.880,2.710,6.170
Dreamlike.art,Design,Art,https://dreamlike.art,ai art creation suite,1040511.000,923441.000,636731.000,212.365,0.736,0.185,0.698,6.657,7.360,1.850,6.980
Riffusion,Entertainment,Music,https://riffusion.com,"Riffusion is a website that provides a number of AI services, including a machine learning platform, a natural language processing platform, and a number of other AI-related services.",989885.000,439520.000,318686.000,292.337,0.663,0.057,0.819,6.648,6.630,0.570,8.190
Creator AI,Content Creation,Copywriting,https://www.creaitor.ai/,the ai writing tool that will help you take your writing to the next level!,431798.000,239299.000,120040.000,485.372,0.559,0.040,0.950,6.635,5.590,0.400,9.500
WordAI,Content Creation,General Writing,https://wordai.com,The WordAi website provides a service that uses artificial intelligence to rewrite text. The service is designed to improve the quality of writing and to make it more readable.,731505.000,1355274.000,1050792.000,118.403,0.791,0.790,0.468,6.617,7.910,7.900,4.680
Wellsaidlabs,Productivity,Text To Speech,https://wellsaidlabs.com,beautiful voices at your fingertips with text-to-speech that captivates. reduce costs and streamline the voice production process.,471583.000,356428.000,418160.000,204.100,0.698,0.423,0.675,6.613,6.980,4.230,6.750
Socratic by Google,Industry-specific,Research,https://socratic.org,"take a photo of your homework question and get answers, math solvers, explanations, and videos. works for math, science, history, english, and more.",6700460.000,6435835.000,6406923.000,85.499,0.930,0.499,0.365,6.609,9.300,4.990,3.650
Contenda,Marketing,Social Media Assistant,https://contenda.co,repurpose your technical content better and faster than an agency using generative ai.,17264.000,22632.000,34823.000,684.574,0.353,0.899,0.983,6.596,3.530,8.990,9.830
LongShot,Marketing,SEO,https://longShot.ai,The website provides a service that uses artificial intelligence to generate factually accurate blogs in minutes.,142605.000,140640.000,158833.000,241.478,0.590,0.636,0.750,6.586,5.900,6.360,7.500
Public Prompts,Marketing,Prompts,https://publicprompts.art,"The website provides a collection of high quality, public prompts for use with the Stable Diffusion AI. The prompts are varied and include everything from cute stuffed animals to rendered objects. The aim of the website is to support the team at CompVis and Stability AI by providing public tools and knowledge.",177628.000,201882.000,213138.000,206.650,0.627,0.704,0.682,6.567,6.270,7.040,6.820
Once Upon A Bot,Content Creation,Story Teller,https://onceuponabot.com,create stories with ai,93768.000,46444.000,63385.000,767.616,0.473,0.223,0.992,6.556,4.730,2.230,9.920
Steno,Customer Support,Search Engine,https://steno.ai,"discover, reference, and read along as you listen.",82841.000,139147.000,119907.000,237.519,0.557,0.794,0.741,6.543,5.570,7.940,7.410
Teachable Machine,Coding,Low-code/no-code,https://teachablemachine.withgoogle.com,"train a computer to recognize your own images, sounds, & poses.                a fast, easy way to create machine learning models for your sites, apps, and more – no expertise or coding required.",310247.000,283148.000,323394.000,198.277,0.665,0.572,0.658,6.529,6.650,5.720,6.580
Type Studio,Content Creation,Video Editing,https://typestudio.co,"type studio is a text-based video editor. instead of editing in the classic video timeline, you simply edit your video by editing the transcribed text.",596524.000,205858.000,178772.000,324.443,0.605,0.045,0.862,6.518,6.050,0.450,8.620
Resemble,Productivity,Text To Speech,https://resemble.ai,use resemble's ai voice generator to clone your voice for free! create ai voices that sound real with resemble's real-time speech-to-speech software.,1757591.000,1453981.000,1877100.000,109.639,0.837,0.601,0.431,6.510,8.370,6.010,4.310
WiziShop,Content Creation,Copywriting,https://wizishop.com/ai,create an ecommerce website and start selling your products online. 15-day free trial. no credit card required.,52759.000,58066.000,57143.000,384.500,0.453,0.611,0.904,6.492,4.530,6.110,9.040
SlidesAI,Productivity,Productivity,https://slidesai.io,The website provides a presentation creation service that uses AI to generate slides from text.,1014123.000,1431920.000,1087623.000,124.110,0.794,0.602,0.479,6.488,7.940,6.020,4.790
Rewind AI,Management,Memory,https://rewind.ai,"the search engine for your life. find anything you've seen, said, or heard.",369856.000,433169.000,371309.000,187.115,0.673,0.551,0.633,6.448,6.730,5.510,6.330
FeedHive,Marketing,Social Media Assistant,https://feedhive.com,"create, publish, and easily manage your social media content at scale with feedhive's ai-powered platform",364994.000,241875.000,219039.000,254.665,0.635,0.178,0.773,6.445,6.350,1.780,7.730
3D Creation ,Design,3D,https://3dpresso.ai/,The website provides an AI service that can be used to create 3D models from images.,25831.000,88497.000,60948.000,269.417,0.468,0.922,0.794,6.438,4.680,9.220,7.940
ArticleForge,Marketing,SEO,https://articleforge.com,"an ai content generator that automatically produces complete high-quality, unique, seo-friendly articles in a single click.",183890.000,161251.000,140210.000,287.517,0.575,0.285,0.813,6.412,5.750,2.850,8.130
Scale,Productivity,Productivity,https://scale.com,"trusted by world class companies, scale delivers high quality training data for ai applications such as self-driving cars, mapping, ar/vr, robotics, and more.",587631.000,483363.000,540636.000,158.856,0.723,0.454,0.569,6.345,7.230,4.540,5.690
Sheet+,Management,Spreadsheets,https://sheetplus.ai,The website provides an AI-powered formula generator and formula explainer. The formula generator can convert text to accurate Excel formulas and Google Sheets formulas within seconds. The formula explainer can provide step-by-step explanations for any Excel or Google Sheets formula.,55273.000,251397.000,216487.000,152.932,0.632,0.973,0.552,6.341,6.320,9.730,5.520
Digirama,Design,Avatars,https://apps.apple.com/us/app/character-creator-digirama/id6444673721,"discover the innovative world of apple and shop everything iphone, ipad, apple watch, mac, and apple tv, plus explore accessories, entertainment, and expert device support.",120224176.000,110290026.000,115972581.000,52.893,0.977,0.504,0.234,6.325,9.770,5.040,2.340
Compose,Content Creation,General Writing,https://compose.ai,compose is a free chrome extension that lets you automate your writing using ai. we shouldn't be spending 40% of our time typing every day: it's time to change the game.,792288.000,858906.000,989831.000,106.766,0.783,0.734,0.418,6.321,7.830,7.340,4.180
Tome,Industry-specific,Startup,https://beta.tome.app,"unlock your best work with tome's ai-powered storytelling format. type in a prompt and generate entire narratives from scratch within seconds, supported by gpt-3 and ai-generated images from dall·e 2.",6766096.000,6958689.000,2993160.000,116.397,0.874,0.098,0.463,6.320,8.740,0.980,4.630
VWO,Coding,Low-code/no-code,https://vwo.com,vwo is the market-leading a/b testing tool that fast-growing companies use for experimentation & conversion rate optimization.,484096.000,356923.000,401647.000,186.100,0.685,0.351,0.632,6.304,6.850,3.510,6.320
Unbound,Content Creation,Copywriting,https://www.unboundcontent.ai,"do creative better, faster",74544.000,70213.000,68733.000,319.217,0.489,0.459,0.847,6.292,4.890,4.590,8.470
Validator AI,Industry-specific,Startup,https://validatorai.com,ai validation for any business idea.,278065.000,257416.000,221043.000,208.033,0.637,0.321,0.687,6.254,6.370,3.210,6.870
Zevi.ai,Coding,Low-code/no-code,https://zevi.ai,"zevi's ai-powered site search and discovery platform helps customers discover products quickly, boosting sales & conversions. get a site search solution tailored to your needs.",30302.000,37118.000,35234.000,464.895,0.357,0.684,0.940,6.229,3.570,6.840,9.400
Lavender,Marketing,Sales,https://lavender.ai,"lavender helps thousands of sellers around the world write better emails faster, getting them more positive replies in less time. rated 4.9/5 on g2.",190344.000,230345.000,175023.000,206.700,0.604,0.451,0.683,6.203,6.040,4.510,6.830
Patterned AI,Design,Design Assistant,http://patterned.ai/,generate seamless patterns with ai! make your own unique pattern or search royalty-free stock images & download for free!,186830.000,123901.000,91644.000,322.222,0.527,0.123,0.859,6.194,5.270,1.230,8.590
Brancher AI,Coding,Low-code/no-code,https://brancher.ai,our platform allows users to create and share custom single-purpose apps without coding knowledge. our goal is to make ai accessible to the masses and promote harmony between humans and ai through a simple and user-friendly interface.,361605.000,435894.000,539285.000,111.917,0.720,0.810,0.444,6.186,7.200,8.100,4.440
AskCodi,Coding,Code Assistant,https://www.askcodi.com,"askcodi simplifies your development process by giving you the power to create prototypes and applications faster, helping you scale their impact.",102958.000,158073.000,239829.000,134.084,0.645,0.918,0.507,6.171,6.450,9.180,5.070
DeepMotion,Design,3D,https://www.deepmotion.com/,generate 3d animations from video in seconds through any web browser. ai powered motion capture and real time body tracking that's easy to use. get started for free!,682361.000,597259.000,430525.000,176.416,0.700,0.195,0.614,6.151,7.000,1.950,6.140
Krea,Customer Support,Search Engine,https://krea.ai,explore millions of ai generated images and create collections of prompts.,383653.000,254580.000,199397.000,227.281,0.622,0.138,0.725,6.148,6.220,1.380,7.250
nichess,Content Creation,General Writing,https://nichesss.com,ready to start generating content in seconds? nichesss has got you covered. 💪,302065.000,256394.000,277815.000,169.749,0.655,0.453,0.604,6.144,6.550,4.530,6.040
Luna,Marketing,Email Assistant,https://getluna.dev,access millions of leads and personalize cold emails instantly with luna. the ai technology which founders and sdrs love for winning deals.,29988.000,30549.000,43434.000,296.775,0.408,0.795,0.824,6.131,4.080,7.950,8.240
Waymark,Content Creation,Video Generator,https://waymark.com,waymark’s ai video creator makes it so fast and easy to create compelling sample commercials that you can walk into any and every prospect meeting with spec creative.,657385.000,378627.000,409280.000,179.711,0.693,0.193,0.615,6.118,6.930,1.930,6.150
Botowski,Content Creation,Copywriting,https://www.botowski.com/,"ai content generator that creates content for businesses and people who aren't professional writers. it offers a diverse range of automatic content generation tools, from catchy slogans for branding purposes to email templates or blog content.",93492.000,96224.000,60853.000,354.583,0.466,0.216,0.892,6.114,4.660,2.160,8.920
Build AI,Coding,Low-code/no-code,https://buildai.space,"The website provides a service that allows users to create their own AI-powered web apps. users simply need to describe what they want the AI to do for their business, and the website will generate a custom app for them. There is no need for any technical skills, and users can test and tune the app as needed. Once they are satisfied, they can share the app with others or use it internally.",889170.000,820875.000,635625.000,150.651,0.733,0.253,0.547,6.106,7.330,2.530,5.470
AI Trip Planner,Productivity,Life Assistant,https://buildai.space,"The website provides a platform for users to create their own AI-powered web apps. There is no need for users to have any technical skills in order to create their own app. All that is required is for users to describe what they want their app to do, and the platform will generate the app for them. Users can then customize the app as they wish, and test it out with an input to see the results. Once they are satisfied with the app, they can share it with others via a link, or embed it on their own website.",889170.000,820875.000,635625.000,150.651,0.733,0.253,0.547,6.106,7.330,2.530,5.470
Listnr,Productivity,Text To Speech,https://listnr.tech,"ai voice generator with over 900+ voiceovers in 142+ languages, create realistic ai voice overs in seconds. export in mp3 or wav format. get started for free!",139118.000,173436.000,191258.000,157.062,0.614,0.770,0.564,6.096,6.140,7.700,5.640
Glasp,Content Creation,General Writing,https://glasp.co,"glasp is a social web highlighter that people can highlight and organize quotes and thoughts from the web, and access other like-minded people’s learning.",1569876.000,1276003.000,1239826.000,110.362,0.806,0.311,0.434,6.077,8.060,3.110,4.340
StoryWizard,Content Creation,Story Teller,https://storywizard.ai,The website provides a service that uses AI to generate children's stories. It asks the user a series of questions in order to personalize the story. It also provides tools for educators to create engaging and interactive assignments for their students.,27271.000,42741.000,42076.000,287.116,0.398,0.824,0.811,6.058,3.980,8.240,8.110
BHuman,Productivity,Personalized Videos,https://bhuman.ai,foster human connections at scale with customers by leveraging our groundbreaking ai that enables you to make personalized videos at scale that look real.,248746.000,209436.000,181866.000,207.680,0.609,0.261,0.685,6.046,6.090,2.610,6.850
Nanonets,Coding,Low-code/no-code,https://nanonets.com,"ai-based intelligent document processing with nanonets' self-learning ocr. automate data capture from invoices, receipts, passports, id cards & more!",372290.000,505442.000,473715.000,109.633,0.708,0.742,0.430,6.002,7.080,7.420,4.300
Marketplan,Productivity,Productivity,https://marketplan.io,"platformbuilt for youresourcespricing demo log infree accountplatformbuilt for youresourcespricing demo log infree accountthe all in one marketing platform plan, execute, project, and optimize your entire marketing strategy all from one powerful place.get free accountsee how it worksmarketplan works in every stage of your marketing journey more than 10 built-for-marketing mini apps join our thousands of […]",102952.000,80435.000,80226.000,258.421,0.516,0.300,0.778,5.992,5.160,3.000,7.780
Tabnine,Coding,Code Assistant,https://www.tabnine.com,"whether you’re part of a team, or a developer working on your own, tabnine will help you write code faster – all in your favorite ide.",2625309.000,2212099.000,2031991.000,85.354,0.847,0.296,0.362,5.979,8.470,2.960,3.620
Genei,Content Creation,Summarizer,https://genei.io,"genei is a intelligent research tool enabling you to improve productivity by using a custom ai algorithm to summarise articles, analyse research and find key information, instantly.",351169.000,431352.000,237848.000,182.992,0.643,0.228,0.627,5.951,6.430,2.280,6.270
BlackInk,Productivity,Life Assistant,https://blackink.ai,create your own unique flash tattoo in seconds.,40182.000,64611.000,101046.000,160.041,0.546,0.927,0.572,5.945,5.460,9.270,5.720
Pinegraph,Design,Design Assistant,https://pinegraph.com/,pinegraph | ai art sketchpad,51733.000,154786.000,43890.000,336.463,0.410,0.379,0.879,5.945,4.100,3.790,8.790
Profile Picture AI,Design,Avatars,https://www.profilepicture.ai,"your profile picture is the first thing people see when they look at your profile. we use artificial intelligence to generate pfps of you that looks perfect and captures who you are. make a profile picture with ai, you can be anything, anywhere, or anyone!",851248.000,561468.000,404130.000,166.823,0.688,0.115,0.592,5.923,6.880,1.150,5.920
Scene One,Content Creation,Story Teller,https://sceneone.app,"free online novel writing software. sceneone.app works in your browser and on every device, including your phone! write your first story for free with an app created by writers for writers. write the way you want and not be constrained by someone else's style. write smarter with our tools, and always have up-to-date software.",26708.000,26884.000,30863.000,359.576,0.332,0.674,0.894,5.910,3.320,6.740,8.940
VisualHound,Industry-specific,Fashion,https://visualhound.com,VisualHound is a service that allows users to create realistic product images using artificial intelligence. This can be used to create moodboards and boost the design process. The service is free for 5 images.,6680.000,7535.000,37967.000,246.299,0.375,0.983,0.761,5.902,3.750,9.830,7.610
Excel Formula Bot,Management,Spreadsheets,https://excelformulabot.com,transform your text instructions into excel & google sheets formulas in seconds with the help of ai.,1019668.000,1111616.000,507532.000,149.580,0.713,0.126,0.541,5.855,7.130,1.260,5.410
Subtxt,Content Creation,Story Teller,https://subtxt.app,"subtxt is the only intelligent outliner that works with your writer's intuition, not against it.",28123.000,27195.000,28370.000,469.155,0.299,0.556,0.945,5.831,2.990,5.560,9.450
Audiolabs,Content Creation,Video Generator,https://audiolabs.io,"looking to reach new listeners with your podcast content? lean into short-form video and publish snippets to tiktok, youtube shorts and other video apps.",93406.000,117719.000,64275.000,281.916,0.476,0.233,0.804,5.829,4.760,2.330,8.040
Bria,Content Creation,Image Editing,https://bria.ai,"create faster, better customized visual content at scale with bria’s proprietary generative ai technology.",25646.000,70196.000,77814.000,163.726,0.506,0.953,0.580,5.803,5.060,9.530,5.800
Contentfries,Content Creation,Video Editing,https://contentfries.com,content multiplier app to help you spread your message as far and wide as possible - contentfries,49061.000,45473.000,48675.000,260.175,0.426,0.542,0.779,5.788,4.260,5.420,7.790
Repl AI,Marketing,Social Media Assistant,https://replai.so,rocketship your twitter audience with ai-autosuggest 🚀 comment and respond to 10x more people in 2 minutes.,36196.000,54029.000,53456.000,212.731,0.436,0.807,0.700,5.787,4.360,8.070,7.000
Axiom,Coding,Low-code/no-code,https://axiom.ai,"build browser bots quickly, without code. automate website actions and repetitive tasks using just your browser, on any website or web app.",479182.000,576188.000,415445.000,121.045,0.697,0.403,0.474,5.784,6.970,4.030,4.740
Upword,Content Creation,Summarizer,https://upword.ai,Upword.ai is a content summarization tool that uses AI to process information and create summary documents.,2162466.000,382486.000,223416.000,191.015,0.638,0.012,0.645,5.782,6.380,0.120,6.450
Generated Photos,Customer Support,Search Engine,https://generated.photos,"ai-generated images have never looked better. explore and download our diverse, copyright-free headshot images from our production-ready database.",866013.000,822777.000,794435.000,95.062,0.753,0.448,0.388,5.765,7.530,4.480,3.880
Unscreen.com,Content Creation,Video Editing,https://unscreen.com,"remove the background of any video - 100% automatically, online & free! goodbye greenscreen. hello unscreen.",1174144.000,1139370.000,1031804.000,82.743,0.789,0.413,0.348,5.750,7.890,4.130,3.480
HelloScribe,Content Creation,General Writing,https://helloscribe.ai,meet the a.i-partner that helps you write original content and flawless copy in seconds.,122722.000,51129.000,41575.000,440.569,0.395,0.060,0.927,5.743,3.950,0.600,9.270
Mintlify,Coding,Developer Tools,https://mintlify.com,"build the documentation you've always wanted. beautiful out of the box, easy to maintain, and optimized for user engagement.",50208.000,77641.000,77550.000,167.385,0.504,0.825,0.599,5.741,5.040,8.250,5.990
Sheet AI,Management,Spreadsheets,https://sheetai.app,sheetai is a google sheets add-on that helps you unlock the power of ai in your spreadsheets.,60663.000,64580.000,58801.000,232.564,0.458,0.512,0.733,5.734,4.580,5.120,7.330
typly,Productivity,Productivity,https://typly.app,"Typly is an AI-powered keyboard app that provides users with suggested responses to messages, based on the context of the conversation. The app also offers a dating function, which suggests flirting sentences to users based on image processing techniques, analyzed descriptions and successful conversations. Additionally, Typly offers a marketplace of sentence bundles, which allows users to diversify their conversations with text from movies, viral posts or specialist jargon.",16854.000,59321.000,23813.000,352.061,0.269,0.785,0.891,5.694,2.690,7.850,8.910
Diagram,Design,Design Assistant,https://diagram.com,generative creativity,174186.000,117976.000,245291.000,106.779,0.647,0.779,0.420,5.694,6.470,7.790,4.200
Designify,Design,Design Assistant,https://www.designify.com/,create exceptional product photos and more: pick any image to start the magic ✨,396917.000,371114.000,275031.000,150.348,0.653,0.243,0.546,5.692,6.530,2.430,5.460
Autodraw,Design,Design Assistant,https://autodraw.com,fast drawing for everyone. autodraw pairs machine learning with drawings from talented artists to help you draw stuff fast.,1854904.000,1670606.000,1432115.000,74.978,0.816,0.291,0.322,5.659,8.160,2.910,3.220
Evoto AI,Content Creation,Image Editing,https://evoto.ai,"Evoto is an AI-powered image editor that simplifies your workflow and unleashes your creativity. With Evoto, you can quickly touch-up your photos, add a glow effect, or make precise adjustments to different elements of your photo.",406742.000,258191.000,228270.000,160.547,0.642,0.153,0.574,5.659,6.420,1.530,5.740
TLDR this,Content Creation,Summarizer,https://tldrthis.com,"tldr this is a free online text summarizing tool that automatically condenses long articles, documents, essays, or papers into key summary paragraphs using state-of-the-art ai.",643702.000,411955.000,407947.000,128.885,0.692,0.203,0.496,5.647,6.920,2.030,4.960
Opus,Content Creation,Video Generator,https://opus.ai,"Opus.ai provides a service that helps businesses to automate the process of extracting data from documents. It uses artificial intelligence and natural language processing to identify and extract data from documents, and then stores the data in a structured format that can be easily accessed and analyzed.",100980.000,239828.000,169779.000,111.902,0.599,0.860,0.443,5.627,5.990,8.600,4.430
Andi,Customer Support,Search Engine,https://andisearch.com,"andi is search for the next generation using generative ai. instead of just links, andi gives you answers - like chatting with a smart friend",841507.000,825783.000,569836.000,111.626,0.726,0.226,0.439,5.612,7.260,2.260,4.390
Cleanvoice AI,Content Creation,Audio Editing,https://cleanvoice.ai,"cleanvoice is an artificial intelligence, which removes filler sounds (uh’s, um’s), mouth sounds (ex. lip-smacking) and stuttering from your podcast or audio recording.",120683.000,104204.000,94305.000,190.087,0.537,0.301,0.643,5.558,5.370,3.010,6.430
